{
  "schema_version": "1.1",
  "id": "rights:S52",
  "source_id": "S52",
  "artifact_sha256": "64a713006631971fa5fef67ea302e68424a6d9cc1d3060ecd08028974193412f",
  "edition_id": "bsb:berean-standard-bible:usfm-2026-03-08",
  "status": "unknown",
  "license_identifier": "LicenseRef-BSB-Public-Domain-Dedication-2023-04-30",
  "evidence_url": "https://berean.bible/terms.htm",
  "license_artifact_sha256": "e9a15ae12bc992c8db6d6ea3efc1467a1ac97e7632cb02ce7267de33f4afd251",
  "jurisdictions": [
    "worldwide (dedication by the rights holder)"
  ],
  "attribution": "The Holy Bible, Berean Standard Bible, BSB is produced in cooperation with Bible Hub, Discovery Bible, OpenBible.com, and the Berean Bible Translation Committee. This text of God's Word has been dedicated to the public domain.",
  "permissions": {
    "local_read": "allow",
    "redistribute": "allow",
    "modify": "allow",
    "public_index": "allow",
    "model_prompt": "allow",
    "model_train": "allow",
    "translation_evaluate": "allow"
  },
  "reviewer": null,
  "reviewed_at": null,
  "acquisition": {
    "upstream_url": "https://bereanbible.com/bsb_usfm.zip",
    "commit": null,
    "release": "USFM export dated 2026-03-08 inside the zip; tables and text files fetched the same day",
    "fetched_on": "2026-10-28",
    "fetched_by": "b003 agent (Claude Fable 5.1) for the source steward",
    "method": "curl -sSL of bsb_usfm.zip, bsb_tables.xlsx and bsb.txt from bereanbible.com and of terms.htm and downloads.htm from berean.bible",
    "storage": "/Volumes/office-hub/openlogos/corpora/S52-bsb/ (NAS, SMB; MANIFEST.sha256 beside the data)",
    "paths": [
      "bsb_usfm.zip",
      "bsb_tables.xlsx",
      "bsb.txt",
      "terms.htm (berean.bible/terms.htm)",
      "downloads.htm (berean.bible/downloads.htm)"
    ],
    "file_count": 5,
    "bytes": 61456431,
    "manifest_sha256": "64a713006631971fa5fef67ea302e68424a6d9cc1d3060ecd08028974193412f",
    "manifest_path": "rights/S52/manifest.sha256",
    "fetch_seconds": 60
  },
  "coverage": {
    "scope": "Protestant canon, 66 books, Old and New Testament",
    "books": 66,
    "verses": 31086,
    "tokens": null,
    "counting_rule": "66 .usfm files in bsb_usfm.zip (one \\id per file); 31,086 \\v markers in those files; bsb.txt holds 31,102 verse lines (bridged verses are one \\v in USFM and separate lines in the text file)"
  },
  "license_files": [
    {
      "path": "terms.htm",
      "sha256": "e9a15ae12bc992c8db6d6ea3efc1467a1ac97e7632cb02ce7267de33f4afd251",
      "says": "Terms and Conditions, April 30, 2023: \"The Berean Bible and Majority Bible texts are officially dedicated to the public domain as of April 30, 2023. All uses are freely permitted.\" and \"For derivative works that vary from the official text, we respectfully request that the Berean name is not used.\""
    }
  ],
  "flags": [
    {
      "kind": "naming_condition",
      "text": "Berean name only on unaltered text: \"All applications that maintain the verbatim text from the above Berean sites are invited to bear the Berean name. For derivative works that vary from the official text, we respectfully request that the Berean name is not used.\" (terms.htm, April 30, 2023). The translation lab (specs/19) renames any altered text.",
      "resolves_by": "Policy already in specs/19; no research needed."
    }
  ],
  "upstream_dependencies": [],
  "steward_proposal": {
    "decision": "clear",
    "rationale": "Public-domain dedication by the rights holder on a dated terms page captured beside the bytes; the only condition is a naming request the project already honours.",
    "proposed_by": "b003 agent (Claude Fable 5.1) for the source steward",
    "proposed_on": "2026-10-28"
  },
  "notes": "bsb.txt is UTF-8 with BOM and CRLF; bsb_usfm.zip entries are dated 2026-03-08 and carry \"\\id GEN Autogenerated BSB by bsb2usfm\". The verse-count difference between the USFM and the text file is a bridging difference, not missing text."
}
